<?xml version="1.0" encoding="UTF-8"?>
<xs:schema xmlns:xs="http://www.w3.org/2001/XMLSchema">

  <xs:element name="root">
    <xs:complexType>
      <xs:sequence>
        <xs:element name="transistor" maxOccurs="unbounded">
          <xs:complexType>
            <xs:sequence>
              <xs:element name="name" type="xs:string"/>

              <xs:simpleType name="TransistorType">
                <xs:restriction base="xs:string">
                  <xs:enumeration value="BJT"/>
                  <xs:enumeration value="MOSFET"/>
                  <xs:enumeration value="IGBT"/>
                  <xs:enumeration value="JFET"/>
                  <xs:enumeration value="Darlington"/>
                </xs:restriction>
              </xs:simpleType>
              
              <xs:element name="types">
                <xs:complexType>
                  <xs:sequence>
                    <xs:element name="type" type="TransistorType" maxOccurs="unbounded"/>
                  </xs:sequence>
                </xs:complexType>
              </xs:element>
              
              <xs:element name="voltage">
                <xs:complexType>
                  <xs:simpleContent>
                    <xs:extension base="xs:decimal">
                      <xs:attribute name="currency" type="xs:string" fixed="V" use="required"/>
                    </xs:extension>
                  </xs:simpleContent>
                </xs:complexType>
              </xs:element>
              
              <xs:element name="amperage">
                <xs:complexType>
                  <xs:simpleContent>
                    <xs:extension base="xs:decimal">
                      <xs:attribute name="currency" type="xs:string" fixed="A" use="required"/>
                    </xs:extension>
                  </xs:simpleContent>
                </xs:complexType>
              </xs:element>
              
              <xs:element name="price">
                <xs:complexType>
                  <xs:simpleContent>
                    <xs:extension base="xs:decimal">
                      <xs:attribute name="currency" type="xs:string" fixed="USD" use="required"/>
                    </xs:extension>
                  </xs:simpleContent>
                </xs:complexType>
              </xs:element>
              
              <xs:element name="country" type="xs:string"/>
            </xs:sequence>
            <xs:attribute name="id" type="xs:string" use="required"/>
          </xs:complexType>
        </xs:element>
      </xs:sequence>
    </xs:complexType>
  </xs:element>

</xs:schema>
